{
  "apiVersion": "projectctl/v1",
  "kind": "SetupReport",
  "mode": "bootstrap",
  "contractRef": "sample-setup",
  "overallState": "incomplete_manual",
  "items": [
    {
      "itemKey": "target/primary/project",
      "surface": "project",
      "targetRef": "primary",
      "outcome": "already_conformant",
      "blocking": false,
      "verification": "provider_readback",
      "diagnostic": "setup.project.already-conformant"
    },
    {
      "itemKey": "target/primary/repository-link/sample-org/tasks",
      "surface": "repository_link",
      "targetRef": "primary",
      "outcome": "already_conformant",
      "blocking": false,
      "verification": "provider_readback",
      "diagnostic": "setup.repository-link.already-conformant",
      "dependencies": ["target/primary/project"]
    },
    {
      "itemKey": "target/primary/view/backlog",
      "surface": "project_view",
      "targetRef": "primary",
      "resourceRef": "backlog",
      "outcome": "planned_create",
      "blocking": false,
      "verification": "none",
      "diagnostic": "setup.view.planned-create",
      "dependencies": ["target/primary/project"]
    },
    {
      "itemKey": "target/primary/workflow/add-open-issues",
      "surface": "project_workflow",
      "targetRef": "primary",
      "resourceRef": "add-open-issues",
      "outcome": "manual_action_required",
      "blocking": true,
      "verification": "none",
      "diagnostic": "setup.workflow.manual",
      "dependencies": ["target/primary/project"]
    },
    {
      "itemKey": "seed/project-overview/issue",
      "surface": "seed_issue",
      "targetRef": "primary",
      "resourceRef": "project-overview",
      "outcome": "planned_create",
      "blocking": false,
      "verification": "none",
      "diagnostic": "setup.seed.planned-create",
      "dependencies": ["target/primary/project"]
    }
  ],
  "manualActions": [
    {
      "actionId": "configure-add-open-issues",
      "itemKey": "target/primary/workflow/add-open-issues",
      "surface": "project_workflow",
      "targetRef": "primary",
      "reason": "configuration_unobservable",
      "summary": "Configure the declared auto-add workflow for the primary Project.",
      "steps": [
        "Open the primary Project workflow settings.",
        "Configure auto-add for sample-org/tasks with filter is:issue is:open.",
        "Enable the workflow and acknowledge this checklist."
      ],
      "acknowledged": false,
      "providerVerified": false
    }
  ]
}
